Community District,Name,Indicator Category,Indicator, Indicator Description,2000,2006,2010,2019,2021,2022,2023
BK 01,Greenpoint/Williamsburg,Demographics,Born in New York State,The percentage of city residents who were born in New York State.,,50.8%,52.0%,47.4%,43.1%,47.6%,
BK 01,Greenpoint/Williamsburg,Demographics,Disabled population,"The percentage of the adult population who have disabilities that impair hearing, vision, ambulation, cognition, self-care, or independent living.",,,5.0%,4.9%,6.6%,7.7%,
BK 01,Greenpoint/Williamsburg,Demographics,Foreign-born population,The share of the population that is born outside the United States or Puerto Rico.,33.5%,29.1%,25.8%,24.2%,23.6%,22.0%,
BK 01,Greenpoint/Williamsburg,Demographics,Population,"All people, both children and adults, living in a given geographic area.","142,098","141,513","146,253","151,308","159,580","186,944",
BK 01,Greenpoint/Williamsburg,Demographics,Population aged 65+,The percentage of residents who are aged 65 years and older.,9.9%,12.5%,9.1%,10.3%,8.7%,10.1%,
BK 01,Greenpoint/Williamsburg,Demographics,Households with children under 18 years old,The percentage of households living with children under 18.,35.0%,24.2%,25.2%,20.7%,19.3%,17.6%,
BK 01,Greenpoint/Williamsburg,Demographics,Single-person households,The share of households that include only one person.,,35.0%,31.3%,29.6%,32.4%,35.3%,
BK 01,Greenpoint/Williamsburg,Demographics,Percent Asian,The percentage of the total population that identifies as Asian (non-Hispanic).,3.9%,5.2%,5.2%,6.6%,7.6%,6.1%,
BK 01,Greenpoint/Williamsburg,Demographics,Percent Black,The percentage of the total population that identifies as Black (non-Hispanic).,4.0%,2.3%,2.6%,4.5%,3.8%,7.4%,
BK 01,Greenpoint/Williamsburg,Demographics,Percent Hispanic,The percentage of the total population that identifies as Hispanic (of any race).,34.1%,26.8%,30.0%,25.0%,22.2%,24.8%,
BK 01,Greenpoint/Williamsburg,Demographics,Percent White,The percentage of the total population that identifies as White (non-Hispanic).,52.5%,64.0%,60.7%,61.3%,59.4%,56.7%,
BK 01,Greenpoint/Williamsburg,Demographics,Racial diversity index,The probability that two randomly chosen people in a given geographic area will be of a different race.,0.61,0.52,0.54,0.56,0.59,0.61,
BK 01,Greenpoint/Williamsburg,Demographics,Income diversity ratio,"The income earned by the 80th percentile household divided by the income earned by the 20th percentile household for a given geographic area, excluding all households without positive income.",,7.0,6.5,6.9,8.5,5.7,
BK 01,Greenpoint/Williamsburg,Demographics,Homeownership rate,The number of owner-occupied units divided by the total number of occupied housing units.,14.5%,18.1%,17.7%,17.7%,14.6%,16.1%,
BK 01,Greenpoint/Williamsburg,Demographics,Median household income (2023$),The median household's total income of all members of the household aged 15 years or older.,"$49,120","$47,140","$55,980","$113,770","$111,750","$98,750",
BK 01,Greenpoint/Williamsburg,Demographics,"Median household income, homeowners (2023$)",The median owner-occupied household's total income of all members of the household aged 15 years or older.,,"$74,650","$96,710","$158,580","$154,050","$124,820",
BK 01,Greenpoint/Williamsburg,Demographics,"Median household income, renters (2023$)",The median renter household's total income of all members of the household aged 15 years or older.,,"$41,920","$49,580","$104,780","$100,520","$93,690",
BK 01,Greenpoint/Williamsburg,Demographics,Poverty rate,The number of people below the poverty threshold divided by the number of people for whom poverty status was determined.,33.8%,35.2%,26.5%,20.1%,18.8%,18.8%,
BK 01,Greenpoint/Williamsburg,Demographics,"Poverty rate, population aged 65+",The number of people aged 65 or older below the poverty line divided by the total population of that age group for whom poverty status was determined.,,26.5%,28.7%,19.2%,33.7%,23.8%,
BK 01,Greenpoint/Williamsburg,Demographics,"Poverty rate, population under 18 years old",The number of people under 18 years old below the poverty line divided by the total population of that age group for whom poverty status was determined.,,58.2%,40.9%,45.2%,33.3%,34.6%,
BK 01,Greenpoint/Williamsburg,Demographics,Labor force participation rate,"The number of people aged 16 years and older who are in the civilian labor force, divided by the total number of non-institutionalized people aged 16 years and older.",,57.7%,66.4%,73.9%,77.4%,75.2%,
BK 01,Greenpoint/Williamsburg,Demographics,Population aged 25+ without a high school diploma,The percentage of the population aged 25 and older who have not graduated from high school or received a GED.,,32.7%,21.1%,15.5%,10.7%,15.2%,
BK 01,Greenpoint/Williamsburg,Demographics,Unemployment rate,"The number of people aged 16 years and older in the civilian labor force who are unemployed, divided by the total number of people aged 16 years and older in the civilian labor force.",9.8%,6.1%,8.2%,4.0%,11.0%,5.7%,
BK 01,Greenpoint/Williamsburg,Renters and Rental Conditions,Rental vacancy rate,"The number of vacant, habitable, for-rent units divided by the number of renter-occupied units plus vacant, habitable, for-rent units.",,,3.0%,2.8%,2.7%,2.3%,
BK 01,Greenpoint/Williamsburg,Renters and Rental Conditions,"Serious housing code violations (per 1,000 privately owned rental units)","All violations that HPD defines as class C ('immediately hazardous') that were opened in a given time period, regardless of their current status. NOTE: In 2018 some violation types relating to pests were reclassified from B to C class resulting in a shift in the number of violations from B to C.",,23.3,29.3,45.0,38.9,44.1,53.5
BK 01,Greenpoint/Williamsburg,Renters and Rental Conditions,Severe crowding rate (% of renter households),The share of all renter households in which there are more than 1.5 household members for each room in the unit.,,,9.7%,3.6%,3.6%,3.3%,
BK 01,Greenpoint/Williamsburg,Renters and Rental Conditions,"Total housing code violations (per 1,000 privately owned rental units)","All HPD violations defined as class A ('non-hazardous'), class B ('hazardous'), and class C ('immediately hazardous') that were opened in a given time period, regardless of their current status.",,130.3,131.3,197.5,244.2,227.9,247.1
BK 01,Greenpoint/Williamsburg,Renters and Rental Conditions,"Median rent, studios and 1-bedrooms (2023$)","The median gross rent among studios and 1-bedroom units, which includes the amount agreed to or specified in the lease regardless of whether furnishings, utilities, or services are included; and estimated monthly electricity and heating fuel costs paid by the renter.",,,"$1,420","$2,320","$2,490","$2,500",
BK 01,Greenpoint/Williamsburg,Renters and Rental Conditions,"Median rent, 2- and 3-bedrooms (2023$)","The median gross rent among 2-3 bedroom units, which includes the amount agreed to or specified in the lease regardless of whether furnishings, utilities, or services are included; and estimated monthly electricity and heating fuel costs paid by the renter.",,,"$1,400","$1,930","$2,290","$2,270",
BK 01,Greenpoint/Williamsburg,Renters and Rental Conditions,"Median rent, all (2023$)","The median gross rent, which includes the amount agreed to or specified in the lease regardless of whether furnishings, utilities, or services are included; and estimated monthly electricity and heating fuel costs paid by the renter.","$1,060","$1,200","$1,420","$2,340","$2,580","$2,330",
BK 01,Greenpoint/Williamsburg,Renters and Rental Conditions,"Median rent, recent movers (2023$)","The median recent mover household's gross rent, which includes the amount agreed to or specified in the lease regardless of whether furnishings, utilities, or services are included; and estimated monthly electricity and heating fuel costs paid by the renter.",,,"$2,090","$3,100","$3,410","$3,360",
BK 01,Greenpoint/Williamsburg,Renters and Rental Conditions,Change in collected rent (2019-2020),The change in rent collection for buildings with rent regulated units (2019-2020).,,,,,10.9%,,
BK 01,Greenpoint/Williamsburg,Renters and Rental Conditions,Rental units affordable at  30% AMI (% of recently available units),"The share of occupied, recently available rental units that are affordable to appropriately sized households with incomes at 30 of the Area Median Income.",,,7.6%,5.1%,4.5%,4.9%,
BK 01,Greenpoint/Williamsburg,Renters and Rental Conditions,Rental units affordable at  80% AMI (% of recently available units),"The share of occupied, recently available rental units that are affordable to appropriately sized households with incomes at 80 of the Area Median Income.",,,36.9%,19.6%,15.2%,17.8%,
BK 01,Greenpoint/Williamsburg,Renters and Rental Conditions,Rental units affordable at 120% AMI (% of recently available units),"The share of occupied, recently available rental units that are affordable to appropriately sized households with incomes at 120% of the Area Median Income.",,,74.3%,52.6%,47.0%,52.8%,
BK 01,Greenpoint/Williamsburg,Renters and Rental Conditions,Moderately rent-burdened households,The share of renter households whose gross rent made up at least 30 percent of their monthly pre-tax income.,,24.8%,21.9%,17.5%,21.2%,21.6%,
BK 01,Greenpoint/Williamsburg,Renters and Rental Conditions,"Moderately rent-burdened households, low income",The share of low-income renter households whose gross rent made up at least 30 percent of their monthly pre-tax income.,,,27.3%,25.5%,24.5%,24.7%,
BK 01,Greenpoint/Williamsburg,Renters and Rental Conditions,"Moderately rent-burdened households, moderate income",The share of moderate-income renter households whose gross rent made up at least 30 percent of their monthly pre-tax income.,,,32.7%,36.7%,36.4%,35.8%,
BK 01,Greenpoint/Williamsburg,Renters and Rental Conditions,Severely rent-burdened households,The share of renter households whose gross rent made up at least 50 percent of their monthly pre-tax income.,23.7%,,27.6%,24.3%,22.6%,23.4%,
BK 01,Greenpoint/Williamsburg,Renters and Rental Conditions,"Severely rent-burdened households, low income",The share of low-income renter households whose gross rent made up at least 50 percent of their monthly pre-tax income.,,,44.6%,46.3%,47.4%,45.1%,
BK 01,Greenpoint/Williamsburg,Renters and Rental Conditions,"Severely rent-burdened households, moderate income",The share of moderate-income renter households whose gross rent made up at least 50 percent of their monthly pre-tax income.,,,4.2%,8.1%,7.4%,5.7%,
BK 01,Greenpoint/Williamsburg,Renters and Rental Conditions,"Housing choice vouchers (% of occupied, privately owned rental units)",The share of all rental households in privately owned units whose occupants use a housing choice voucher from HUD.,,,8.6%,8.7%,,,
BK 01,Greenpoint/Williamsburg,Housing Market,Housing units,"The number of housings units, which can include a house, apartment, mobile home, group of rooms, or single room that is occupied (or is vacant and intended for occupancy) as separate living quarters.",,"55,769","65,586","69,661","77,305","89,534",
BK 01,Greenpoint/Williamsburg,Housing Market,"Notices of foreclosure rate (per 1,000 1-4 family and condo properties)","The rate of mortgage foreclosure actions initiated per 1,000 1-4 family properties and condominium units.",5.2,5.2,11.9,3.2,3.6,3.9,
BK 01,Greenpoint/Williamsburg,Housing Market,"Notices of foreclosure, all residential properties",The total number of residential properties that had mortgage foreclosure actions initiated against them.,56,70,211,69,85,88,
BK 01,Greenpoint/Williamsburg,Housing Market,"Notices of foreclosure, initial, 1-4 family and condo properties",The total number of 1-4 family properties and condominiums that had a new filing of mortgage foreclosure actions initiated against them after at least six years without having any such filings.,27,37,143,23,31,34,
BK 01,Greenpoint/Williamsburg,Housing Market,"Notices of foreclosure, repeat, 1-4 family and condo properties",The total number of 1-4 family properties and condominiums that had repeat filing of mortgage foreclosure actions initiated against them after already have such a filing in the previous six years.,7,14,25,30,29,33,
BK 01,Greenpoint/Williamsburg,Housing Market,"Pre-foreclosure notice rate (per 1,000 1-4 family and condo properties)","The number of pre-foreclosure notices issued per 1,000 1-4 family homes and condominium units.",,,,17.2,12.7,21.6,16.2
BK 01,Greenpoint/Williamsburg,Housing Market,"Pre-foreclosure notices, 1-4 family and condo properties",The total number of pre-foreclosure notices issued to homeowners of 1-4 family homes and condominium units. These notices are sent 90 days prior to starting a foreclosure action.,,,,281,218,368,282
BK 01,Greenpoint/Williamsburg,Housing Market,"Properties entering REO, 1-4 family",The total number of 1-4 family buildings that completed the foreclosure process and were acquired by the foreclosing lender.,5,0,0,,,,
BK 01,Greenpoint/Williamsburg,Housing Market,FHA/VA-backed home purchase loans (% of home purchase loans),"The percentage of all first-lien loan originations, for the purchase of an owner-occupied home, condominium, or cooperative apartment that were insured or guaranteed by the FHA or VA, as reported by HMDA.",,0.0%,17.3%,0.4%,0.5%,0.6%,
BK 01,Greenpoint/Williamsburg,Housing Market,Higher-cost home purchase loans (% of home purchase loans),"The percentage of all first-lien loan originations, for the purchase of an owner-occupied 1-4 family home, that were reported as 'higher cost' under HMDA.",,3.8%,0.4%,0.8%,0.3%,0.8%,
BK 01,Greenpoint/Williamsburg,Housing Market,Higher-cost refinance loans (% of refinance loans),"The percentage of loan originations, for the refinancing of an owner-occupied 1-4 family home, that were reported as 'higher cost' under HMDA.",,23.2%,1.7%,1.3%,0.4%,0.0%,
BK 01,Greenpoint/Williamsburg,Housing Market,"Home purchase loan rate (per 1,000 properties)","The number of first-lien home purchase loan originations for owner-occupied 1-4 family buildings, condominiums, or cooperative apartments  divided by the total number of 1-4 family buildings, condominiums, and cooperative apartments.",,40.1,40.4,26.9,40.0,33.3,
BK 01,Greenpoint/Williamsburg,Housing Market,Home purchase loans in LMI tracts (% of home purchase loans),"The share of all first-lien loans, for the purchase of an owner-occupied 1-4 family building, condominium, or cooperative apartments, that were originated for homes in low- to moderate-income census tracts.",,59.5%,4.8%,19.5%,16.1%,18.8%,
BK 01,Greenpoint/Williamsburg,Housing Market,Home purchase loans to LMI borrowers (% of home purchase loans),"The share of all first-lien loan originations, for the purchase of an owner-occupied 1-4 family building, condominium, or cooperative apartment, that were made to low- to moderate-income borrowers.",,2.4%,48.3%,1.4%,1.9%,3.2%,
BK 01,Greenpoint/Williamsburg,Housing Market,"Refinance loan rate (per 1,000 properties)","The number of refinance loans for owner-occupied 1-4 family buildings, condominiums, and cooperative apartments divided by the total number of 1-4 family buildings, condominiums, and cooperative apartments in the given geographic.",,23.1,10.3,15.9,40.4,12.3,
BK 01,Greenpoint/Williamsburg,Housing Market,"Sales volume, 1 family building",The number of transactions of 1 family residential properties that have a non-trivial price and the sale must not be marked as 'insignificant' by the Department of Finance.,12,16,12,10,12,10,14
BK 01,Greenpoint/Williamsburg,Housing Market,"Sales volume, 2-4 family building",The number of transactions of 2-4 family residential properties that have a non-trivial price and the sale must not be marked as 'insignificant' by the Department of Finance.,131,163,74,68,81,141,101
BK 01,Greenpoint/Williamsburg,Housing Market,"Sales volume, 5+ family building",The number of transactions of 5+ family residential properties that have a non-trivial price and the sale must not be marked as 'insignificant' by the Department of Finance.,63,81,54,46,72,93,69
BK 01,Greenpoint/Williamsburg,Housing Market,"Sales volume, condominium",The number of transactions of condominiums that have a non-trivial price and the sale must not be marked as 'insignificant' by the Department of Finance.,72,737,761,606,804,590,431
BK 01,Greenpoint/Williamsburg,Housing Market,"Sales volume, all property types",The number of transactions of all residential properties that have a non-trivial price and the sale must not be marked as 'insignificant' by the Department of Finance.,278,997,901,730,969,834,615
BK 01,Greenpoint/Williamsburg,Housing Market,"Median sales price per unit, 1 family building (2023$)",The median price per unit for one unit buildings.,"$417,270","$867,370","$905,040","$1,823,190","$1,988,370","$2,416,480","$1,199,500"
BK 01,Greenpoint/Williamsburg,Housing Market,"Median sales price per unit, 2-4 family building (2023$)",The median price per unit for two- to four-unit buildings.,"$188,200","$419,460","$377,660","$905,520","$771,110","$864,330","$800,000"
BK 01,Greenpoint/Williamsburg,Housing Market,"Median sales price per unit, 5+ family building (2023$)",The median price per unit for multifamily buildings.,"$66,160","$180,550","$167,110","$463,820","$415,610","$453,050","$450,000"
BK 01,Greenpoint/Williamsburg,Housing Market,"Median sales price per unit, condominium (2023$)",The median price per unit for condominiums.,"$468,150","$736,790","$677,780","$1,232,830","$1,214,500","$1,210,890","$1,175,000"
BK 01,Greenpoint/Williamsburg,Housing Market,"Index of housing price appreciation, 1 family building",The average price changes in repeated sales of the same 1 family properties (index=100 in 2000).,100.0,238.5,249.9,621.2,633.0,755.5,472.2
BK 01,Greenpoint/Williamsburg,Housing Market,"Index of housing price appreciation, 2-4 family building",The average price changes in repeated sales of the same 2-4 family properties (index=100 in 2000).,100.0,252.7,218.7,676.8,747.2,776.2,762.4
BK 01,Greenpoint/Williamsburg,Housing Market,"Index of housing price appreciation, 5+ family building",The average price changes in repeated sales of the same 5+ family properties (index=100 in 2000).,100.0,288.0,300.8,771.9,757.2,816.6,953.7
BK 01,Greenpoint/Williamsburg,Housing Market,"Index of housing price appreciation, condominium",The average price changes in repeated sales of the same condominiums (index=100 in 2000).,100.0,138.3,119.6,231.4,240.4,252.4,259.5
BK 01,Greenpoint/Williamsburg,Housing Market,"Index of housing price appreciation, all property types",The average price changes in repeated sales of the same properties of any type (index=100 in 2000).,100.0,271.6,243.5,492.3,514.5,551.6,573.1
BK 01,Greenpoint/Williamsburg,Development,Units authorized by new residential building permits,The number of units authorized by new residential building permits is derived from the building permit and jobs reports of the DOB.,757,0,221,"1,843","1,449","5,408",667
BK 01,Greenpoint/Williamsburg,Development,Units issued new certificates of occupancy,The number of residential units in buildings issued new certificates of occupancy issued by the DOB each year.,114,942,"2,496","1,985",638,"1,988","2,306"
BK 01,Greenpoint/Williamsburg,Development,"Population density (1,000 persons per square mile)",The geographic area's population divided by its land area and is reported in thousands of people per square mile.,,34.3,35.5,36.7,38.7,45.3,
BK 01,Greenpoint/Williamsburg,Subsidized Housing,Total number of subsidized properties (properties),"Total number of subsidized properties (includes federal programs, Mitchell-Lama, NYC Housing Production Programs and Zoning Incentives or Requirements, and New York State Property Tax Incentives, except 421-a and J-51)",,,,,,,483
BK 01,Greenpoint/Williamsburg,Subsidized Housing,HUD Financing or Insurance (properties),Total number of properties receiving a benefit from a HUD Financing or Insurance Program,,,,,,,26
BK 01,Greenpoint/Williamsburg,Subsidized Housing,HUD Financing or Insurance (units),Total number of units in properties receiving a benefit from a HUD Financing or Insurance Program (all affordable),,,,,,,"1,697"
BK 01,Greenpoint/Williamsburg,Subsidized Housing,HUD Project-based Rental Assistance Program (properties),Total number of properties receiving a benefit from a HUD Project-based Rental Assistance Program,,,,,,,35
BK 01,Greenpoint/Williamsburg,Subsidized Housing,HUD Project-based Rental Assistance Program (units),Total number of units in properties receiving a benefit from a HUD Project-based Rental Assistance Program (includes both affordable and market rate units),,,,,,,"1,806"
BK 01,Greenpoint/Williamsburg,Subsidized Housing,Low Income Housing Tax Credit (properties),Total number of properties receiving a benefit from the Low Income Housing Tax Credit,,,,,,,43
BK 01,Greenpoint/Williamsburg,Subsidized Housing,Low Income Housing Tax Credit (units),Total number of units in properties receiving a benefit from the Low Income Housing Tax Credit (includes both affordable and market rate units),,,,,,,"3,387"
BK 01,Greenpoint/Williamsburg,Subsidized Housing,Public Housing (properties),Total number of public housing properties (includes housing owned and operated by NYCHA even if the properties were not originally public housing),,,,,,,35
BK 01,Greenpoint/Williamsburg,Subsidized Housing,Public Housing (units),Total number of public housing units (includes housing owned and operated by NYCHA even if the properties were not originally public housing),,,,,,,"6,896"
BK 01,Greenpoint/Williamsburg,Subsidized Housing,Public housing (% of rental units),The share of all rental units located in New York City Housing Authority public housing.,,,,,,,9.6%
BK 01,Greenpoint/Williamsburg,Subsidized Housing,Mitchell-Lama (properties),Total number of properties receiving a benefit from the Mitchell-Lama program,,,,,,,11
BK 01,Greenpoint/Williamsburg,Subsidized Housing,Mitchell-Lama (units),Total number of units in properties receiving a benefit from the Mitchell-Lama program (all affordable),,,,,,,"4,021"
BK 01,Greenpoint/Williamsburg,Subsidized Housing,421-a Tax Exemption (properties),Total number of properties using a 421-a tax emption (includes properties with only market rate units),,,,,,,688
BK 01,Greenpoint/Williamsburg,Subsidized Housing,421-a Tax Exemption (units),Total number of units in properties using a 421-a tax emption (includes both affordable and market rate units),,,,,,,"18,767"
BK 01,Greenpoint/Williamsburg,Subsidized Housing,420-c Tax Exemption (properties),Total number of properties using a 420-c tax emption,,,,,,,63
BK 01,Greenpoint/Williamsburg,Subsidized Housing,420-c Tax Exemption (units),Total number of units in properties using a 420-c tax emption (all affordable),,,,,,,"1,615"
BK 01,Greenpoint/Williamsburg,Subsidized Housing,NYC Housing Production Programs and Zoning Incentives or Requirements (properties),"Total number of properties that entered a New York City housing production program or zoning incentive or requirement between July 1,  2003 and December 31, 2017",,,,,,,243
BK 01,Greenpoint/Williamsburg,Subsidized Housing,Eligible to expire from housing programs between 2024 and 2029 (properties),"Total number of properties eligible to expire between 2023 and 2028 (expiration based on HUD Financing and Insurance programs, HUD project based rental assistance, LIHTC, and the Mitchell-Lama program only)",,,,,,,17
BK 01,Greenpoint/Williamsburg,Subsidized Housing,Eligible to expire from housing programs between 2024 and 2029 (units),"Total number of units in properties eligible to expire between 2023 and 2028 (expiration based on HUD Financing and Insurance programs, HUD project based rental assistance, LIHTC, and the Mitchell-Lama program only)",,,,,,,585
BK 01,Greenpoint/Williamsburg,Subsidized Housing,Eligible to expire from housing programs between 2030 and 2039 (properties),"Total number of properties eligible to expire between 2029 and 2038 (expiration based on HUD Financing and Insurance programs, HUD project based rental assistance, LIHTC, and the Mitchell-Lama program only)",,,,,,,16
BK 01,Greenpoint/Williamsburg,Subsidized Housing,Eligible to expire from housing programs between 2030 and 2039 (units),"Total number of units in properties eligible to expire between 2029 and 2038 (expiration based on HUD Financing and Insurance programs, HUD project based rental assistance, LIHTC, and the Mitchell-Lama program only)",,,,,,,"1,388"
BK 01,Greenpoint/Williamsburg,Subsidized Housing,Eligible to expire from housing programs in 2040 and later (properties),"Total number of properties eligible to expire in 2039 and later (expiration based on HUD Financing and Insurance programs, HUD project based rental assistance, LIHTC, and the Mitchell-Lama program only)",,,,,,,52
BK 01,Greenpoint/Williamsburg,Subsidized Housing,Eligible to expire from housing programs in 2040 and later (units),"Total number of units in properties eligible to expire in 2039 and later (expiration based on HUD Financing and Insurance programs, HUD project based rental assistance, LIHTC, and the Mitchell-Lama program only)",,,,,,,"6,330"
BK 01,Greenpoint/Williamsburg,Neighborhood Services and Conditions,Car-free commute (% of commuters),"The percentage of workers who commute primarily by foot, bicycle, or public transportation, as a share of all workers over the age of 16 who do not work at home.",76.6%,79.3%,85.2%,85.8%,75.0%,83.7%,
BK 01,Greenpoint/Williamsburg,Neighborhood Services and Conditions,Mean travel time to work (minutes),The mean commute time in minutes for commuters residing in the geographic area.,35.3,33.4,31.5,34.5,34.6,34.6,
