Community District,Name,Indicator Category,Indicator, Indicator Description,2000,2006,2010,2019,2021,2022,2023
MN 10,Central Harlem,Demographics,Born in New York State,The percentage of city residents who were born in New York State.,,57.6%,57.5%,58.5%,52.4%,54.1%,
MN 10,Central Harlem,Demographics,Disabled population,"The percentage of the adult population who have disabilities that impair hearing, vision, ambulation, cognition, self-care, or independent living.",,,11.8%,10.6%,11.8%,10.8%,
MN 10,Central Harlem,Demographics,Foreign-born population,The share of the population that is born outside the United States or Puerto Rico.,17.8%,20.8%,19.7%,20.5%,23.4%,26.5%,
MN 10,Central Harlem,Demographics,Population,"All people, both children and adults, living in a given geographic area.","109,091","118,143","126,558","136,351","128,792","138,953",
MN 10,Central Harlem,Demographics,Population aged 65+,The percentage of residents who are aged 65 years and older.,11.3%,10.3%,10.5%,11.9%,13.6%,12.2%,
MN 10,Central Harlem,Demographics,Households with children under 18 years old,The percentage of households living with children under 18.,34.0%,32.5%,27.8%,22.8%,23.4%,21.9%,
MN 10,Central Harlem,Demographics,Single-person households,The share of households that include only one person.,,46.9%,41.5%,42.7%,45.7%,45.3%,
MN 10,Central Harlem,Demographics,Percent Asian,The percentage of the total population that identifies as Asian (non-Hispanic).,0.8%,2.3%,3.5%,3.6%,3.9%,4.5%,
MN 10,Central Harlem,Demographics,Percent Black,The percentage of the total population that identifies as Black (non-Hispanic).,77.3%,69.5%,58.6%,54.3%,44.2%,45.8%,
MN 10,Central Harlem,Demographics,Percent Hispanic,The percentage of the total population that identifies as Hispanic (of any race).,16.8%,18.4%,23.6%,23.6%,27.0%,28.2%,
MN 10,Central Harlem,Demographics,Percent White,The percentage of the total population that identifies as White (non-Hispanic).,2.1%,6.8%,11.8%,15.5%,17.5%,14.4%,
MN 10,Central Harlem,Demographics,Racial diversity index,The probability that two randomly chosen people in a given geographic area will be of a different race.,0.37,0.48,0.59,0.62,0.70,0.69,
MN 10,Central Harlem,Demographics,Income diversity ratio,"The income earned by the 80th percentile household divided by the income earned by the 20th percentile household for a given geographic area, excluding all households without positive income.",,7.5,7.5,8.9,8.3,9.2,
MN 10,Central Harlem,Demographics,Homeownership rate,The number of owner-occupied units divided by the total number of occupied housing units.,6.6%,12.2%,13.4%,14.0%,15.5%,13.4%,
MN 10,Central Harlem,Demographics,Median household income (2023$),The median household's total income of all members of the household aged 15 years or older.,"$38,930","$39,400","$47,240","$63,590","$49,820","$51,990",
MN 10,Central Harlem,Demographics,"Median household income, homeowners (2023$)",The median owner-occupied household's total income of all members of the household aged 15 years or older.,,"$131,470","$148,520","$151,190","$140,870","$129,260",
MN 10,Central Harlem,Demographics,"Median household income, renters (2023$)",The median renter household's total income of all members of the household aged 15 years or older.,,"$35,170","$42,020","$58,130","$41,030","$41,890",
MN 10,Central Harlem,Demographics,Poverty rate,The number of people below the poverty threshold divided by the number of people for whom poverty status was determined.,36.4%,28.7%,28.1%,20.1%,28.4%,28.2%,
MN 10,Central Harlem,Demographics,"Poverty rate, population aged 65+",The number of people aged 65 or older below the poverty line divided by the total population of that age group for whom poverty status was determined.,,34.0%,27.5%,25.2%,36.8%,28.8%,
MN 10,Central Harlem,Demographics,"Poverty rate, population under 18 years old",The number of people under 18 years old below the poverty line divided by the total population of that age group for whom poverty status was determined.,,33.7%,35.8%,26.4%,35.5%,26.8%,
MN 10,Central Harlem,Demographics,Labor force participation rate,"The number of people aged 16 years and older who are in the civilian labor force, divided by the total number of non-institutionalized people aged 16 years and older.",,60.7%,56.8%,69.0%,64.5%,60.3%,
MN 10,Central Harlem,Demographics,Population aged 25+ without a high school diploma,The percentage of the population aged 25 and older who have not graduated from high school or received a GED.,,26.3%,21.1%,13.9%,16.0%,18.5%,
MN 10,Central Harlem,Demographics,Unemployment rate,"The number of people aged 16 years and older in the civilian labor force who are unemployed, divided by the total number of people aged 16 years and older in the civilian labor force.",18.6%,13.4%,15.9%,8.7%,15.9%,10.5%,
MN 10,Central Harlem,Renters and Rental Conditions,Rental vacancy rate,"The number of vacant, habitable, for-rent units divided by the number of renter-occupied units plus vacant, habitable, for-rent units.",,,4.7%,4.6%,5.1%,4.7%,
MN 10,Central Harlem,Renters and Rental Conditions,"Serious housing code violations (per 1,000 privately owned rental units)","All violations that HPD defines as class C ('immediately hazardous') that were opened in a given time period, regardless of their current status. NOTE: In 2018 some violation types relating to pests were reclassified from B to C class resulting in a shift in the number of violations from B to C.",,52.5,50.5,122.9,143.1,175.7,214.6
MN 10,Central Harlem,Renters and Rental Conditions,Severe crowding rate (% of renter households),The share of all renter households in which there are more than 1.5 household members for each room in the unit.,,,3.0%,2.4%,2.8%,2.9%,
MN 10,Central Harlem,Renters and Rental Conditions,"Total housing code violations (per 1,000 privately owned rental units)","All HPD violations defined as class A ('non-hazardous'), class B ('hazardous'), and class C ('immediately hazardous') that were opened in a given time period, regardless of their current status.",,285.0,243.6,439.7,556.3,588.2,675.8
MN 10,Central Harlem,Renters and Rental Conditions,"Median rent, studios and 1-bedrooms (2023$)","The median gross rent among studios and 1-bedroom units, which includes the amount agreed to or specified in the lease regardless of whether furnishings, utilities, or services are included; and estimated monthly electricity and heating fuel costs paid by the renter.",,,$990,"$1,190","$1,340","$1,400",
MN 10,Central Harlem,Renters and Rental Conditions,"Median rent, 2- and 3-bedrooms (2023$)","The median gross rent among 2-3 bedroom units, which includes the amount agreed to or specified in the lease regardless of whether furnishings, utilities, or services are included; and estimated monthly electricity and heating fuel costs paid by the renter.",,,"$1,030","$1,260","$1,350","$1,410",
MN 10,Central Harlem,Renters and Rental Conditions,"Median rent, all (2023$)","The median gross rent, which includes the amount agreed to or specified in the lease regardless of whether furnishings, utilities, or services are included; and estimated monthly electricity and heating fuel costs paid by the renter.",$860,$940,"$1,060","$1,440","$1,350","$1,300",
MN 10,Central Harlem,Renters and Rental Conditions,"Median rent, recent movers (2023$)","The median recent mover household's gross rent, which includes the amount agreed to or specified in the lease regardless of whether furnishings, utilities, or services are included; and estimated monthly electricity and heating fuel costs paid by the renter.",,,"$1,310","$2,130","$2,220","$2,270",
MN 10,Central Harlem,Renters and Rental Conditions,Change in collected rent (2019-2020),The change in rent collection for buildings with rent regulated units (2019-2020).,,,,,6.2%,,
MN 10,Central Harlem,Renters and Rental Conditions,Rental units affordable at  30% AMI (% of recently available units),"The share of occupied, recently available rental units that are affordable to appropriately sized households with incomes at 30 of the Area Median Income.",,,19.3%,18.5%,10.8%,11.4%,
MN 10,Central Harlem,Renters and Rental Conditions,Rental units affordable at  80% AMI (% of recently available units),"The share of occupied, recently available rental units that are affordable to appropriately sized households with incomes at 80 of the Area Median Income.",,,59.2%,41.0%,42.3%,45.9%,
MN 10,Central Harlem,Renters and Rental Conditions,Rental units affordable at 120% AMI (% of recently available units),"The share of occupied, recently available rental units that are affordable to appropriately sized households with incomes at 120% of the Area Median Income.",,,86.9%,87.5%,86.3%,86.3%,
MN 10,Central Harlem,Renters and Rental Conditions,Moderately rent-burdened households,The share of renter households whose gross rent made up at least 30 percent of their monthly pre-tax income.,,24.8%,26.4%,18.9%,25.0%,19.4%,
MN 10,Central Harlem,Renters and Rental Conditions,"Moderately rent-burdened households, low income",The share of low-income renter households whose gross rent made up at least 30 percent of their monthly pre-tax income.,,,29.4%,31.5%,30.2%,27.4%,
MN 10,Central Harlem,Renters and Rental Conditions,"Moderately rent-burdened households, moderate income",The share of moderate-income renter households whose gross rent made up at least 30 percent of their monthly pre-tax income.,,,15.6%,23.2%,17.3%,16.4%,
MN 10,Central Harlem,Renters and Rental Conditions,Severely rent-burdened households,The share of renter households whose gross rent made up at least 50 percent of their monthly pre-tax income.,24.1%,,24.1%,23.7%,25.1%,26.4%,
MN 10,Central Harlem,Renters and Rental Conditions,"Severely rent-burdened households, low income",The share of low-income renter households whose gross rent made up at least 50 percent of their monthly pre-tax income.,,,34.0%,33.7%,36.5%,37.7%,
MN 10,Central Harlem,Renters and Rental Conditions,"Severely rent-burdened households, moderate income",The share of moderate-income renter households whose gross rent made up at least 50 percent of their monthly pre-tax income.,,,4.5%,1.1%,1.9%,2.7%,
MN 10,Central Harlem,Renters and Rental Conditions,"Housing choice vouchers (% of occupied, privately owned rental units)",The share of all rental households in privately owned units whose occupants use a housing choice voucher from HUD.,,,7.6%,7.1%,,,
MN 10,Central Harlem,Housing Market,Housing units,"The number of housings units, which can include a house, apartment, mobile home, group of rooms, or single room that is occupied (or is vacant and intended for occupancy) as separate living quarters.",,"57,994","61,313","63,719","64,827","69,281",
MN 10,Central Harlem,Housing Market,"Notices of foreclosure rate (per 1,000 1-4 family and condo properties)","The rate of mortgage foreclosure actions initiated per 1,000 1-4 family properties and condominium units.",32.9,7.7,13.3,6.4,2.0,3.3,
MN 10,Central Harlem,Housing Market,"Notices of foreclosure, all residential properties",The total number of residential properties that had mortgage foreclosure actions initiated against them.,137,42,106,51,21,32,
MN 10,Central Harlem,Housing Market,"Notices of foreclosure, initial, 1-4 family and condo properties",The total number of 1-4 family properties and condominiums that had a new filing of mortgage foreclosure actions initiated against them after at least six years without having any such filings.,40,21,57,17,5,11,
MN 10,Central Harlem,Housing Market,"Notices of foreclosure, repeat, 1-4 family and condo properties",The total number of 1-4 family properties and condominiums that had repeat filing of mortgage foreclosure actions initiated against them after already have such a filing in the previous six years.,8,3,7,21,8,11,
MN 10,Central Harlem,Housing Market,"Pre-foreclosure notice rate (per 1,000 1-4 family and condo properties)","The number of pre-foreclosure notices issued per 1,000 1-4 family homes and condominium units.",,,,36.9,14.4,30.9,22.9
MN 10,Central Harlem,Housing Market,"Pre-foreclosure notices, 1-4 family and condo properties",The total number of pre-foreclosure notices issued to homeowners of 1-4 family homes and condominium units. These notices are sent 90 days prior to starting a foreclosure action.,,,,219,95,204,152
MN 10,Central Harlem,Housing Market,"Properties entering REO, 1-4 family",The total number of 1-4 family buildings that completed the foreclosure process and were acquired by the foreclosing lender.,2,0,0,,,,
MN 10,Central Harlem,Housing Market,FHA/VA-backed home purchase loans (% of home purchase loans),"The percentage of all first-lien loan originations, for the purchase of an owner-occupied home, condominium, or cooperative apartment that were insured or guaranteed by the FHA or VA, as reported by HMDA.",,0.0%,14.7%,0.4%,0.3%,0.5%,
MN 10,Central Harlem,Housing Market,Higher-cost home purchase loans (% of home purchase loans),"The percentage of all first-lien loan originations, for the purchase of an owner-occupied 1-4 family home, that were reported as 'higher cost' under HMDA.",,6.5%,1.3%,0.0%,1.2%,0.5%,
MN 10,Central Harlem,Housing Market,Higher-cost refinance loans (% of refinance loans),"The percentage of loan originations, for the refinancing of an owner-occupied 1-4 family home, that were reported as 'higher cost' under HMDA.",,29.8%,2.8%,2.2%,0.0%,0.7%,
MN 10,Central Harlem,Housing Market,"Home purchase loan rate (per 1,000 properties)","The number of first-lien home purchase loan originations for owner-occupied 1-4 family buildings, condominiums, or cooperative apartments  divided by the total number of 1-4 family buildings, condominiums, and cooperative apartments.",,37.8,42.9,19.9,28.1,31.0,
MN 10,Central Harlem,Housing Market,Home purchase loans in LMI tracts (% of home purchase loans),"The share of all first-lien loans, for the purchase of an owner-occupied 1-4 family building, condominium, or cooperative apartments, that were originated for homes in low- to moderate-income census tracts.",,92.0%,6.6%,33.1%,42.8%,28.6%,
MN 10,Central Harlem,Housing Market,Home purchase loans to LMI borrowers (% of home purchase loans),"The share of all first-lien loan originations, for the purchase of an owner-occupied 1-4 family building, condominium, or cooperative apartment, that were made to low- to moderate-income borrowers.",,5.1%,98.5%,4.7%,5.3%,7.0%,
MN 10,Central Harlem,Housing Market,"Refinance loan rate (per 1,000 properties)","The number of refinance loans for owner-occupied 1-4 family buildings, condominiums, and cooperative apartments divided by the total number of 1-4 family buildings, condominiums, and cooperative apartments in the given geographic.",,28.2,9.8,11.4,37.9,11.9,
MN 10,Central Harlem,Housing Market,"Sales volume, 1 family building",The number of transactions of 1 family residential properties that have a non-trivial price and the sale must not be marked as 'insignificant' by the Department of Finance.,3,10,3,3,3,5,5
MN 10,Central Harlem,Housing Market,"Sales volume, 2-4 family building",The number of transactions of 2-4 family residential properties that have a non-trivial price and the sale must not be marked as 'insignificant' by the Department of Finance.,51,55,29,21,28,27,14
MN 10,Central Harlem,Housing Market,"Sales volume, 5+ family building",The number of transactions of 5+ family residential properties that have a non-trivial price and the sale must not be marked as 'insignificant' by the Department of Finance.,47,78,44,29,30,36,26
MN 10,Central Harlem,Housing Market,"Sales volume, condominium",The number of transactions of condominiums that have a non-trivial price and the sale must not be marked as 'insignificant' by the Department of Finance.,20,191,341,194,301,410,154
MN 10,Central Harlem,Housing Market,"Sales volume, all property types",The number of transactions of all residential properties that have a non-trivial price and the sale must not be marked as 'insignificant' by the Department of Finance.,121,334,417,247,362,478,199
MN 10,Central Harlem,Housing Market,"Median sales price per unit, 1 family building (2023$)",The median price per unit for one unit buildings.,"$573,420","$1,448,040","$2,138,950","$2,581,410","$3,139,530","$2,343,810","$2,750,000"
MN 10,Central Harlem,Housing Market,"Median sales price per unit, 2-4 family building (2023$)",The median price per unit for two- to four-unit buildings.,"$237,580","$460,570","$410,330","$969,480","$936,350","$865,190","$601,670"
MN 10,Central Harlem,Housing Market,"Median sales price per unit, 5+ family building (2023$)",The median price per unit for multifamily buildings.,"$56,940","$167,540","$132,350","$286,270","$174,880","$175,990","$146,430"
MN 10,Central Harlem,Housing Market,"Median sales price per unit, condominium (2023$)",The median price per unit for condominiums.,"$296,210","$794,800","$803,130","$1,079,450","$1,020,070","$978,810","$807,500"
MN 10,Central Harlem,Housing Market,"Index of housing price appreciation, 1 family building",The average price changes in repeated sales of the same 1 family properties (index=100 in 2000).,100.0,858.7,"1,985.1","1,058.8","1,925.2","1,209.1","1,733.1"
MN 10,Central Harlem,Housing Market,"Index of housing price appreciation, 2-4 family building",The average price changes in repeated sales of the same 2-4 family properties (index=100 in 2000).,100.0,334.2,212.4,600.1,583.5,636.2,508.4
MN 10,Central Harlem,Housing Market,"Index of housing price appreciation, 5+ family building",The average price changes in repeated sales of the same 5+ family properties (index=100 in 2000).,100.0,354.0,261.4,642.4,661.8,503.3,613.7
MN 10,Central Harlem,Housing Market,"Index of housing price appreciation, condominium",The average price changes in repeated sales of the same condominiums (index=100 in 2000).,100.0,265.3,283.5,482.6,465.0,496.8,452.6
MN 10,Central Harlem,Housing Market,"Index of housing price appreciation, all property types",The average price changes in repeated sales of the same properties of any type (index=100 in 2000).,100.0,316.9,305.4,555.5,542.6,551.1,525.6
MN 10,Central Harlem,Development,Units authorized by new residential building permits,The number of units authorized by new residential building permits is derived from the building permit and jobs reports of the DOB.,261,0,77,496,252,691,56
MN 10,Central Harlem,Development,Units issued new certificates of occupancy,The number of residential units in buildings issued new certificates of occupancy issued by the DOB each year.,87,232,603,277,575,117,504
MN 10,Central Harlem,Development,"Population density (1,000 persons per square mile)",The geographic area's population divided by its land area and is reported in thousands of people per square mile.,,82.6,88.5,95.4,90.1,97.2,
MN 10,Central Harlem,Subsidized Housing,Total number of subsidized properties (properties),"Total number of subsidized properties (includes federal programs, Mitchell-Lama, NYC Housing Production Programs and Zoning Incentives or Requirements, and New York State Property Tax Incentives, except 421-a and J-51)",,,,,,,"1,351"
MN 10,Central Harlem,Subsidized Housing,HUD Financing or Insurance (properties),Total number of properties receiving a benefit from a HUD Financing or Insurance Program,,,,,,,22
MN 10,Central Harlem,Subsidized Housing,HUD Financing or Insurance (units),Total number of units in properties receiving a benefit from a HUD Financing or Insurance Program (all affordable),,,,,,,"1,437"
MN 10,Central Harlem,Subsidized Housing,HUD Project-based Rental Assistance Program (properties),Total number of properties receiving a benefit from a HUD Project-based Rental Assistance Program,,,,,,,68
MN 10,Central Harlem,Subsidized Housing,HUD Project-based Rental Assistance Program (units),Total number of units in properties receiving a benefit from a HUD Project-based Rental Assistance Program (includes both affordable and market rate units),,,,,,,"3,853"
MN 10,Central Harlem,Subsidized Housing,Low Income Housing Tax Credit (properties),Total number of properties receiving a benefit from the Low Income Housing Tax Credit,,,,,,,380
MN 10,Central Harlem,Subsidized Housing,Low Income Housing Tax Credit (units),Total number of units in properties receiving a benefit from the Low Income Housing Tax Credit (includes both affordable and market rate units),,,,,,,"10,236"
MN 10,Central Harlem,Subsidized Housing,Public Housing (properties),Total number of public housing properties (includes housing owned and operated by NYCHA even if the properties were not originally public housing),,,,,,,63
MN 10,Central Harlem,Subsidized Housing,Public Housing (units),Total number of public housing units (includes housing owned and operated by NYCHA even if the properties were not originally public housing),,,,,,,"7,766"
MN 10,Central Harlem,Subsidized Housing,Public housing (% of rental units),The share of all rental units located in New York City Housing Authority public housing.,,,,,,,17.4%
MN 10,Central Harlem,Subsidized Housing,Mitchell-Lama (properties),Total number of properties receiving a benefit from the Mitchell-Lama program,,,,,,,6
MN 10,Central Harlem,Subsidized Housing,Mitchell-Lama (units),Total number of units in properties receiving a benefit from the Mitchell-Lama program (all affordable),,,,,,,"2,449"
MN 10,Central Harlem,Subsidized Housing,421-a Tax Exemption (properties),Total number of properties using a 421-a tax emption (includes properties with only market rate units),,,,,,,106
MN 10,Central Harlem,Subsidized Housing,421-a Tax Exemption (units),Total number of units in properties using a 421-a tax emption (includes both affordable and market rate units),,,,,,,"5,364"
MN 10,Central Harlem,Subsidized Housing,420-c Tax Exemption (properties),Total number of properties using a 420-c tax emption,,,,,,,214
MN 10,Central Harlem,Subsidized Housing,420-c Tax Exemption (units),Total number of units in properties using a 420-c tax emption (all affordable),,,,,,,"4,712"
MN 10,Central Harlem,Subsidized Housing,NYC Housing Production Programs and Zoning Incentives or Requirements (properties),"Total number of properties that entered a New York City housing production program or zoning incentive or requirement between July 1,  2003 and December 31, 2017",,,,,,,544
MN 10,Central Harlem,Subsidized Housing,Eligible to expire from housing programs between 2024 and 2029 (properties),"Total number of properties eligible to expire between 2023 and 2028 (expiration based on HUD Financing and Insurance programs, HUD project based rental assistance, LIHTC, and the Mitchell-Lama program only)",,,,,,,69
MN 10,Central Harlem,Subsidized Housing,Eligible to expire from housing programs between 2024 and 2029 (units),"Total number of units in properties eligible to expire between 2023 and 2028 (expiration based on HUD Financing and Insurance programs, HUD project based rental assistance, LIHTC, and the Mitchell-Lama program only)",,,,,,,"1,692"
MN 10,Central Harlem,Subsidized Housing,Eligible to expire from housing programs between 2030 and 2039 (properties),"Total number of properties eligible to expire between 2029 and 2038 (expiration based on HUD Financing and Insurance programs, HUD project based rental assistance, LIHTC, and the Mitchell-Lama program only)",,,,,,,175
MN 10,Central Harlem,Subsidized Housing,Eligible to expire from housing programs between 2030 and 2039 (units),"Total number of units in properties eligible to expire between 2029 and 2038 (expiration based on HUD Financing and Insurance programs, HUD project based rental assistance, LIHTC, and the Mitchell-Lama program only)",,,,,,,"6,241"
MN 10,Central Harlem,Subsidized Housing,Eligible to expire from housing programs in 2040 and later (properties),"Total number of properties eligible to expire in 2039 and later (expiration based on HUD Financing and Insurance programs, HUD project based rental assistance, LIHTC, and the Mitchell-Lama program only)",,,,,,,178
MN 10,Central Harlem,Subsidized Housing,Eligible to expire from housing programs in 2040 and later (units),"Total number of units in properties eligible to expire in 2039 and later (expiration based on HUD Financing and Insurance programs, HUD project based rental assistance, LIHTC, and the Mitchell-Lama program only)",,,,,,,"6,731"
MN 10,Central Harlem,Neighborhood Services and Conditions,Car-free commute (% of commuters),"The percentage of workers who commute primarily by foot, bicycle, or public transportation, as a share of all workers over the age of 16 who do not work at home.",81.7%,83.8%,85.0%,88.0%,85.7%,83.1%,
MN 10,Central Harlem,Neighborhood Services and Conditions,Mean travel time to work (minutes),The mean commute time in minutes for commuters residing in the geographic area.,37.3,35.5,34.7,36.1,38.1,37.4,
MN 10,Central Harlem,Neighborhood Services and Conditions,"Serious crime rate (per 1,000 residents)","The number of serious crimes, those classified as a major felony as defined by the NYPD, committed in a given geographic area per 1,000 residents.",,23.1,17.0,16.8,18.0,18.9,18.5
MN 10,Central Harlem,Neighborhood Services and Conditions,"Serious crime rate, property (per 1,000 residents)","The number of serious property crimes, those classified as a major felony as defined by the NYPD, committed in a given geographic area per 1,000 residents.",,11.3,7.9,8.0,9.1,10.0,10.0
MN 10,Central Harlem,Neighborhood Services and Conditions,"Serious crime rate, violent (per 1,000 residents)","The number of serious property crimes, those classified as a major felony as defined by the NYPD, committed in a given geographic area per 1,000 residents.",,11.9,9.2,8.8,9.0,8.9,8.5
